{
  "schemaVersion": "0.1",
  "packetStatus": "candidate",
  "ledgerManifest": {
    "id": "cel:example:provenance-demo",
    "title": "Provenance Demo Ledger",
    "version": "0.1.0",
    "scope": "Demonstration ledger for claim-evidence packet structure."
  },
  "authority": {
    "id": "cel:authority:example-issuer",
    "name": "Example Issuer",
    "uri": "https://example.com/issuer"
  },
  "claimEvidenceContract": {
    "claim": "The dataset was generated by the published pipeline on 2025-01-15.",
    "evidenceType": "dataset",
    "sourceReference": {
      "type": "contentHash",
      "uri": "ipfs://bafybeigdyrzt5sfp7udm7ha76u5lq2shs2wtjsuk3qjnx5xh3q2example",
      "contentHash": "sha256:0123456789abcdef0123456789abcdef0123456789abcdef0123456789abcdef"
    },
    "verificationStatus": "pending",
    "receiptRef": {
      "receiptId": "receipt:example:0001",
      "receiptUri": "https://example.com/receipts/0001"
    }
  },
  "receiptRequirements": {
    "inclusionProof": "merkle",
    "timestamp": true,
    "anchor": "internal"
  }
}
